Sheet: Settings
A1: 角色属性表
A2: 等级 | B2: Damage | C2: Armor | D2: Life | E2: critical chance | F2: critical damage | G2: Reduce damage | H2: Increase damage | I2: 图标
A3: 1 | B3: 80 | C3: 48 | D3: 320 | E3: 0.5 | F3: 40 | G3: 0 | H3: 0 | I3: Icon_01
A4: 2 | B4: =RC10*R4C -> 160 | C4: =RC10*R4C -> 96 | D4: =RC10*R4C -> 640 | E4: 1 | F4: =RC10*R4C -> 80 | G4: 0 | H4: 0 | I4: Icon_02
A5: 3 | B5: =RC10*R4C -> 240 | C5: =RC10*R4C -> 144 | D5: =RC10*R4C -> 960 | E5: 1.5 | F5: =RC10*R4C -> 120 | G5: 0 | H5: 0 | I5: Icon_03
A6: 4 | B6: =RC10*R4C -> 320 | C6: =RC10*R4C -> 192 | D6: =RC10*R4C -> 1280 | E6: 2 | F6: =RC10*R4C -> 160 | G6: 0 | H6: 0 | I6: Icon_04
A7: 5 | B7: =RC10*R4C -> 400 | C7: =RC10*R4C -> 240 | D7: =RC10*R4C -> 1600 | E7: 2.5 | F7: =RC10*R4C -> 200 | G7: 0 | H7: 0 | I7: Icon_05
A8: 6 | B8: =RC10*R4C -> 480 | C8: =RC10*R4C -> 288 | D8: =RC10*R4C -> 1920 | E8: 3 | F8: =RC10*R4C -> 240 | G8: 0 | H8: 0 | I8: Icon_06
A9: 7 | B9: =RC10*R4C -> 560 | C9: =RC10*R4C -> 336 | D9: =RC10*R4C -> 2240 | E9: 3.5 | F9: =RC10*R4C -> 280 | G9: 0 | H9: 0 | I9: Icon_07
A10: 8 | B10: =RC10*R4C -> 640 | C10: =RC10*R4C -> 384 | D10: =RC10*R4C -> 2560 | E10: 4 | F10: =RC10*R4C -> 320 | G10: 0 | H10: 0 | I10: Icon_08
A11: 9 | B11: =RC10*R4C -> 720 | C11: =RC10*R4C -> 432 | D11: =RC10*R4C -> 2880 | E11: 4.5 | F11: =RC10*R4C -> 360 | G11: 0 | H11: 0 | I11: Icon_09
A12: 10 | B12: =RC10*R4C -> 800 | C12: =RC10*R4C -> 480 | D12: =RC10*R4C -> 3200 | E12: 5 | F12: =RC10*R4C -> 400 | G12: 0 | H12: 0 | I12: Icon_10